	title	score	id	url	comms_num	created	body
0	[D] Our community must get serious about opposing OpenAI	2863	11sboh1	https://www.reddit.com/r/MachineLearning/comments/11sboh1/d_our_community_must_get_serious_about_opposing/	464	1678919641.0	"OpenAI was founded for the explicit purpose of democratizing access to AI and acting as a counterbalance to the closed off world of big tech by developing open source tools.

They have abandoned this idea entirely.

Today, with the release of GPT4 and their direct statement that they will not release details of the model creation due to ""safety concerns"" and the competitive environment, they have created a precedent worse than those that existed before they entered the field. We're at risk now of other major players, who previously at least published their work and contributed to open source tools, close themselves off as well.

AI alignment is a serious issue that we definitely have not solved. Its a huge field with a dizzying array of ideas, beliefs and approaches. We're talking about trying to capture the interests and goals of all humanity, after all. In this space, the one approach that is horrifying (and the one that OpenAI was LITERALLY created to prevent) is a singular or oligarchy of for profit corporations making this decision for us. This is exactly what OpenAI plans to do.

I get it, GPT4 is incredible. However, we are talking about the single most transformative technology and societal change that humanity has ever made. It needs to be for everyone or else the average person is going to be left behind.

We need to unify around open source development; choose companies that contribute to science, and condemn the ones that don't.

This conversation will only ever get more important."
1	"[D] I don't really trust papers out of ""Top Labs"" anymore"	1666	uyratt	https://www.reddit.com/r/MachineLearning/comments/uyratt/d_i_dont_really_trust_papers_out_of_top_labs/	264	1653630414.0	"I mean, I trust that the numbers they got are accurate and that they really did the work and got the results. I believe those. It's just that, take the recent ""An Evolutionary Approach to Dynamic Introduction of Tasks in Large-scale Multitask Learning Systems"" paper. It's 18 pages of talking through this pretty convoluted evolutionary and multitask learning algorithm, it's pretty interesting, solves a bunch of problems. But two notes. 

One, the big number they cite as the success metric is 99.43 on CIFAR-10, against a SotA of 99.40, so woop-de-fucking-doo in the grand scheme of things.

Two, there's a chart towards the end of the paper that details how many TPU core-hours were used for just the training regimens that results in the final results. The sum total is 17,810 core-hours. Let's assume that for someone who doesn't work at Google, you'd have to use on-demand pricing of $3.22/hr. This means that these trained models cost $57,348. 

Strictly speaking, throwing enough compute at a general enough genetic algorithm will eventually produce arbitrarily good performance, so while you can absolutely read this paper and collect interesting ideas about how to use genetic algorithms to accomplish multitask learning by having each new task leverage learned weights from previous tasks by defining modifications to a subset of components of a pre-existing model, there's a meta-textual level on which this paper is just ""Jeff Dean spent enough money to feed a family of four for half a decade to get a 0.03% improvement on CIFAR-10.""

OpenAI is far and away the worst offender here, but it seems like everyone's doing it. You throw a fuckton of compute and a light ganache of new ideas at an existing problem with existing data and existing benchmarks, and then if your numbers are infinitesimally higher than their numbers, you get to put a lil' sticker on your CV. Why should I trust that your ideas are even any good? I can't check them, I can't apply them to my own projects. 

Is this really what we're comfortable with as a community? A handful of corporations and the occasional university waving their dicks at everyone because they've got the compute to burn and we don't? There's a level at which I think there should be a new journal, exclusively for papers in which you can replicate their experimental results in under eight hours on a single consumer GPU."
2	[D] Why can't you guys comment your fucking code?	1646	6l2esd	https://www.reddit.com/r/MachineLearning/comments/6l2esd/d_why_cant_you_guys_comment_your_fucking_code/	478	1499113449.0	"Seriously.

I spent the last few years doing web app development. Dug into DL a couple months ago. Supposedly, compared to the post-post-post-docs doing AI stuff, JavaScript developers should be inbred peasants. But every project these peasants release, even a fucking library that colorizes CLI output, has a catchy name, extensive docs, shitloads of comments, fuckton of tests, semantic versioning, changelog, and, oh my god, better variable names than `ctx_h` or `lang_hs` or `fuck_you_for_trying_to_understand`.

The concepts and ideas behind DL, GANs, LSTMs, CNNs, whatever – it's clear, it's simple, it's intuitive. The slog is to go through the jargon (that keeps changing beneath your feet - what's the point of using fancy words if you can't keep them consistent?), the unnecessary equations, trying to squeeze meaning from bullshit language used in papers, figuring out the super important steps, preprocessing, hyperparameters optimization that the authors, oops, failed to mention.

Sorry for singling out, but [look at this](https://github.com/facebookresearch/end-to-end-negotiator/blob/master/src/agent.py) - what the fuck? If a developer anywhere else at Facebook would get this code for a review they would throw up.

- Do you intentionally try to obfuscate your papers? Is pseudo-code a fucking premium? Can you at least try to give some intuition before showering the reader with equations?

- How the fuck do you dare to release a paper without source code?

- Why the fuck do you never ever add comments to you code?

- When naming things, are you charged by the character? Do you get a bonus for acronyms?

- Do you realize that OpenAI having needed to release a ""baseline"" TRPO implementation is a fucking disgrace to your profession?

- Jesus christ, who decided to name a tensor concatenation function `cat`?
"
3	[D] The current and future state of AI/ML is shockingly demoralizing with little hope of redemption	1393	wiqjxv	https://www.reddit.com/r/MachineLearning/comments/wiqjxv/d_the_current_and_future_state_of_aiml_is/	396	1659907526.0	"I recently encountered the PaLM (Scaling Language Modeling with Pathways) paper from Google Research and it opened up a can of worms of ideas I’ve felt I’ve intuitively had for a while, but have been unable to express – and I know I can’t be the only one. Sometimes I wonder what the original pioneers of AI – Turing, Neumann, McCarthy, etc. – would think if they could see the state of AI that we’ve gotten ourselves into. 67 authors, 83 pages, 540B parameters in a model, the internals of which no one can say they comprehend with a straight face, 6144 TPUs in a commercial lab that no one has access to, on a rig that no one can afford, trained on a volume of data that a human couldn’t process in a lifetime, 1 page on ethics with the same ideas that have been rehashed over and over elsewhere with no attempt at a solution – bias, racism, malicious use, etc. – for purposes that who asked for?

When I started my career as an AI/ML research engineer 2016, I was most interested in two types of tasks – 1.) those that most humans could do but that would universally be considered tedious and non-scalable. I’m talking image classification, sentiment analysis, even document summarization, etc. 2.) tasks that humans lack the capacity to perform as well as computers for various reasons – forecasting, risk analysis, game playing, and so forth. I still love my career, and I try to only work on projects in these areas, but it’s getting harder and harder.

This is because, somewhere along the way, it became popular and unquestionably acceptable to push AI into domains that were originally uniquely human, those areas that sit at the top of Maslows’s hierarchy of needs in terms of self-actualization – art, music, writing, singing, programming, and so forth. These areas of endeavor have negative logarithmic ability curves – the vast majority of people cannot do them well at all, about 10% can do them decently, and 1% or less can do them extraordinarily. The little discussed problem with AI-generation is that, without extreme deterrence, we will sacrifice human achievement at the top percentile in the name of lowering the bar for a larger volume of people, until the AI ability range is the norm. This is because relative to humans, AI is cheap, fast, and infinite, to the extent that investments in human achievement will be watered down at the societal, educational, and individual level with each passing year. And unlike AI gameplay which superseded humans decades ago, we won’t be able to just disqualify the machines and continue to play as if they didn’t exist.

Almost everywhere I go, even this forum, I encounter almost universal deference given to current SOTA AI generation systems like GPT-3, CODEX, DALL-E, etc., with almost no one extending their implications to its logical conclusion, which is long-term convergence to the mean, to mediocrity, in the fields they claim to address or even enhance. If you’re an artist or writer and you’re using DALL-E or GPT-3 to “enhance” your work, or if you’re a programmer saying, “GitHub Co-Pilot makes me a better programmer?”, then how could you possibly know? You’ve disrupted and bypassed your own creative process, which is thoughts -> (optionally words) -> actions -> feedback -> repeat, and instead seeded your canvas with ideas from a machine, the provenance of which you can’t understand, nor can the machine reliably explain. And the more you do this, the more you make your creative processes dependent on said machine, until you must question whether or not you could work at the same level without it.

When I was a college student, I often dabbled with weed, LSD, and mushrooms, and for a while, I thought the ideas I was having while under the influence were revolutionary and groundbreaking – that is until took it upon myself to actually start writing down those ideas and then reviewing them while sober, when I realized they weren’t that special at all. What I eventually determined is that, under the influence, it was impossible for me to accurately evaluate the drug-induced ideas I was having because the influencing agent the generates the ideas themselves was disrupting the same frame of reference that is responsible evaluating said ideas. This is the same principle of – if you took a pill and it made you stupider, would even know it? I believe that, especially over the long-term timeframe that crosses generations, there’s significant risk that current AI-generation developments produces a similar effect on humanity, and we mostly won’t even realize it has happened, much like a frog in boiling water. If you have children like I do, how can you be aware of the the current SOTA in these areas, project that 20 to 30 years, and then and tell them with a straight face that it is worth them pursuing their talent in art, writing, or music? How can you be honest and still say that widespread implementation of auto-correction hasn’t made you and others worse and worse at spelling over the years (a task that even I believe most would agree is tedious and worth automating).

Furthermore, I’ve yet to set anyone discuss the train – generate – train - generate feedback loop that long-term application of AI-generation systems imply. The first generations of these models were trained on wide swaths of web data generated by humans, but if these systems are permitted to continually spit out content without restriction or verification, especially to the extent that it reduces or eliminates development and investment in human talent over the long term, then what happens to the 4th or 5th generation of models? Eventually we encounter this situation where the AI is being trained almost exclusively on AI-generated content, and therefore with each generation, it settles more and more into the mean and mediocrity with no way out using current methods. By the time that happens, what will we have lost in terms of the creative capacity of people, and will we be able to get it back?

By relentlessly pursuing this direction so enthusiastically, I’m convinced that we as AI/ML developers, companies, and nations are past the point of no return, and it mostly comes down the investments in time and money that we’ve made, as well as a prisoner’s dilemma with our competitors. As a society though, this direction we’ve chosen for short-term gains will almost certainly make humanity worse off, mostly for those who are powerless to do anything about it – our children, our grandchildren, and generations to come.

If you’re an AI researcher or a data scientist like myself, how do you turn things back for yourself when you’ve spent years on years building your career in this direction? You’re likely making near or north of $200k annually TC and have a family to support, and so it’s too late, no matter how you feel about the direction the field has gone. If you’re a company, how do you standby and let your competitors aggressively push their AutoML solutions into more and more markets without putting out your own? Moreover, if you’re a manager or thought leader in this field like Jeff Dean how do you justify to your own boss and your shareholders your team’s billions of dollars in AI investment while simultaneously balancing ethical concerns? You can’t – the only answer is bigger and bigger models, more and more applications, more and more data, and more and more automation, and then automating that even further. If you’re a country like the US, how do responsibly develop AI while your competitors like China single-mindedly push full steam ahead without an iota of ethical concern to replace you in numerous areas in global power dynamics? Once again, failing to compete would be pre-emptively admitting defeat.

Even assuming that none of what I’ve described here happens to such an extent, how are so few people not taking this seriously and discounting this possibility? If everything I’m saying is fear-mongering and non-sense, then I’d be interested in hearing what you think human-AI co-existence looks like in 20 to 30 years and why it isn’t as demoralizing as I’ve made it out to be.

&#x200B;

EDIT: Day after posting this -- this post took off way more than I expected. Even if I received 20 - 25 comments, I would have considered that a success, but this went much further. Thank you to each one of you that has read this post, even more so if you left a comment, and triply so for those who gave awards! I've read almost every comment that has come in (even the troll ones), and am truly grateful for each one, including those in sharp disagreement. I've learned much more from this discussion with the sub than I could have imagined on this topic, from so many perspectives. While I will try to reply as many comments as I can, the sheer comment volume combined with limited free time between work and family unfortunately means that there are many that I likely won't be able to get to. That will invariably include some that I would love respond to under the assumption of infinite time, but I will do my best, even if the latency stretches into days. Thank you all once again!"
4	[D] Does anybody else despise OpenAI?	1323	13kfxzy	https://www.reddit.com/r/MachineLearning/comments/13kfxzy/d_does_anybody_else_despise_openai/	415	1684361728.0	" I  mean, don't get me started with the closed source models they have that were trained using the work of unassuming individuals who will never  see a penny for it. Put it up on Github they said. I'm all for  open-source, but when a company turns around and charges you for a  product they made with freely and publicly made content, while forbidding you from using the output to create competing models, that is where I  draw the line. It is simply ridiculous. 

Sam Altman couldn't be anymore predictable with his recent attempts to get the government to start regulating AI.

What  risks? The AI is just a messenger for information that is already out  there if one knows how/where to look. You don't need AI to learn how to  hack, to learn how to make weapons, etc. Fake news/propaganda? The  internet has all of that covered. LLMs are no where near the level of AI  you see in sci-fi. I mean, are people really afraid of text? Yes, I  know that text can sometimes be malicious code such as viruses, but  those can be found on github as well.  If they fall for this they might  as well shutdown the internet while they're at it.

He  is simply blowing things out of proportion and using fear to increase  the likelihood that they do what he wants, hurt the competition. I  bet he is probably teething with bitterness everytime a new huggingface  model comes out. The thought of us peasants being able to use AI  privately is too dangerous. No, instead we must be fed scraps while they  slowly take away our jobs and determine our future.

This  is not a doomer post, as I am all in favor of the advancement of AI.  However, the real danger here lies in having a company like OpenAI  dictate the future of humanity. I get it, the writing is on the wall;  the cost of human intelligence will go down, but if everyone has their  personal AI then it wouldn't seem so bad or unfair would it? Listen,  something that has the power to render a college degree that costs  thousands of dollars worthless should be available to the public. This  is to offset the damages and job layoffs that will come as a result of  such an entity. It wouldn't be as bitter of a taste as it would if you were replaced by it while still not being able to access it. Everyone should be able to use it as leverage, it is the only fair solution.

If  we don't take action now, a company like ClosedAI will, and they are  not in favor of the common folk. Sam Altman is so calculated to the  point where there were times when he seemed to be shooting OpenAI in the foot during his talk.  This move is to simply conceal his real intentions, to climb the ladder and take it with him. If he didn't include his company in his  ramblings, he would be easily read. So instead, he pretends to be scared of his own product, in an effort to legitimize his claim. Don't fall  for it.

They are slowly making a  reputation as one the most hated tech companies, right up there with  Adobe, and they don't show any sign of change. They have no moat,  othewise they wouldn't feel so threatened to the point where they would have to resort to creating barriers of entry via regulation. This only  means one thing, we are slowly catching up. We just need someone to  vouch for humanity's well-being, while acting as an opposing force to the  evil corporations who are only looking out for themselves. Question is,  who would be a good candidate?"
5	[P] Landing the Falcon booster with Reinforcement Learning in OpenAI	1293	7y6g79	https://gfycat.com/CoarseEmbellishedIsopod	55	1518871530.0	
6	[P] OpenAssistant - The world's largest open-source replication of ChatGPT	1267	12nbixk	https://www.reddit.com/r/MachineLearning/comments/12nbixk/p_openassistant_the_worlds_largest_opensource/	175	1681578898.0	"We’re excited to announce the release of OpenAssistant.

The future of AI development depends heavily on high quality datasets and models being made publicly available, and that’s exactly what this project does.

Watch the annoucement video:

[https://youtu.be/ddG2fM9i4Kk](https://youtu.be/ddG2fM9i4Kk)

&#x200B;

Our team has worked tirelessly over the past several months collecting large amounts of text-based input and feedback to create an incredibly diverse and unique dataset designed specifically for training language models or other AI applications.

With over 600k human-generated data points covering a wide range of topics and styles of writing, our dataset will be an invaluable tool for any developer looking to create state-of-the-art instruction models!

To make things even better, we are making this entire dataset free and accessible to all who wish to use it. Check it out today at our HF org: OpenAssistant

On top of that, we've trained very powerful models that you can try right now at: [open-assistant.io/chat](https://open-assistant.io/chat) !"
7	"[D] Google ""We Have No Moat, And Neither Does OpenAI"": Leaked Internal Google Document Claims Open Source AI Will Outcompete Google and OpenAI"	1169	137rxgw	https://www.semianalysis.com/p/google-we-have-no-moat-and-neither	205	1683216810.0	
8	We are Oriol Vinyals and David Silver from DeepMind’s AlphaStar team, joined by StarCraft II pro players TLO and MaNa! Ask us anything	1172	ajgzoc	https://www.reddit.com/r/MachineLearning/comments/ajgzoc/we_are_oriol_vinyals_and_david_silver_from/	1011	1548363323.0	"Hi there! We are Oriol Vinyals (/u/OriolVinyals) and David Silver (/u/David_Silver), lead researchers on DeepMind’s AlphaStar team, joined by StarCraft II pro players TLO, and MaNa.

This evening at DeepMind HQ we held a livestream demonstration of AlphaStar playing against TLO and MaNa - you can read more about the matches [here](https://deepmind.com/blog/alphastar-mastering-real-time-strategy-game-starcraft-ii/) or re-watch the stream on YouTube [here](https://www.youtube.com/watch?v=cUTMhmVh1qs).

Now, we’re excited to talk with you about AlphaStar, the challenge of real-time strategy games for AI research, the matches themselves, and anything you’d like to know from TLO and MaNa about their experience playing against AlphaStar! :)

We are opening this thread now and will be here at **16:00 GMT / 11:00 ET / 08:00PT** on Friday, 25 January to answer your questions.

&#x200B;

EDIT: Thanks everyone for your great questions. It was a blast, hope you enjoyed it as well!"
9	[N] OpenAI may have benchmarked GPT-4’s coding ability on it’s own training data	997	124eyso	https://www.reddit.com/r/MachineLearning/comments/124eyso/n_openai_may_have_benchmarked_gpt4s_coding/	135	1679983023.0	"[GPT-4 and professional benchmarks: the wrong answer to the wrong question](https://aisnakeoil.substack.com/p/gpt-4-and-professional-benchmarks)

*OpenAI may have tested on the training data. Besides, human benchmarks are meaningless for bots.*

 **Problem 1: training data contamination**

To benchmark GPT-4’s coding ability, OpenAI evaluated it on problems from Codeforces, a website that hosts coding competitions. Surprisingly, Horace He pointed out that GPT-4 solved 10/10 pre-2021 problems and 0/10 recent problems in the easy category. The training data cutoff for GPT-4 is September 2021. This strongly suggests that the model is able to memorize solutions from its training set — or at least partly memorize them, enough that it can fill in what it can’t recall.

As further evidence for this hypothesis, we tested it on Codeforces problems from different times in 2021. We found that it could regularly solve problems in the easy category before September 5, but none of the problems after September 12.

In fact, we can definitively show that it has memorized problems in its training set: when prompted with the title of a Codeforces problem, GPT-4 includes a link to the exact contest where the problem appears (and the round number is almost correct: it is off by one). Note that GPT-4 cannot access the Internet, so memorization is the only explanation."
10	[D] Our community must get serious about opposing OpenAI	2866	11sboh1	https://www.reddit.com/r/MachineLearning/comments/11sboh1/d_our_community_must_get_serious_about_opposing/	464	1678919641.0	"OpenAI was founded for the explicit purpose of democratizing access to AI and acting as a counterbalance to the closed off world of big tech by developing open source tools.

They have abandoned this idea entirely.

Today, with the release of GPT4 and their direct statement that they will not release details of the model creation due to ""safety concerns"" and the competitive environment, they have created a precedent worse than those that existed before they entered the field. We're at risk now of other major players, who previously at least published their work and contributed to open source tools, close themselves off as well.

AI alignment is a serious issue that we definitely have not solved. Its a huge field with a dizzying array of ideas, beliefs and approaches. We're talking about trying to capture the interests and goals of all humanity, after all. In this space, the one approach that is horrifying (and the one that OpenAI was LITERALLY created to prevent) is a singular or oligarchy of for profit corporations making this decision for us. This is exactly what OpenAI plans to do.

I get it, GPT4 is incredible. However, we are talking about the single most transformative technology and societal change that humanity has ever made. It needs to be for everyone or else the average person is going to be left behind.

We need to unify around open source development; choose companies that contribute to science, and condemn the ones that don't.

This conversation will only ever get more important."
